{"as_of":"2026-10-20","election":2027,"dimensions":[{"id":"rn","question":"Qui porte la candidature du RN ?","review":["2026-12-16 (audience QPC en cassation)","2027-03-12 (clôture des parrainages)","arrêt de cassation"],"states":[{"id":"le_pen","probability":0.88,"candidates":["le_pen_marine"],"placeholders":[],"description":"Marine Le Pen candidate. L'arrêt d'appel du 7 juillet 2026 ramène la partie ferme de l'inéligibilité à 15 mois, déjà purgés ; le pourvoi est suspensif et un rejet la laisse éligible. Le risque résiduel est surtout politique ou lié à une cassation avec « renaissance » contestée de l'exécution provisoire.","sources":[{"label":"lcp.fr","href":"https://lcp.fr/actualites/marine-le-pen-condamnee-dans-l-affaire-des-assistants-parlementaires-reste-eligible-pour"},{"label":"kohenavocats.com","href":"https://kohenavocats.com/marine-le-pen-pourvoi-cassation-memoires-15-octobre-arret-avant-avril-2027/"},{"label":"actu.orange.fr","href":"https://actu.orange.fr/politique/affaire-des-assistants-parlementaires-du-rn-la-cour-de-cassation-fixera-le-sort-de-marine-le-pen-le-16-decembre-l-express-via-6medias-CNT000002t1bDR.html"}],"condition_id":"rn.le_pen"},{"id":"bardella","probability":0.12,"candidates":["bardella_jordan"],"placeholders":[],"description":"Jordan Bardella remplace Marine Le Pen (inéligibilité, choix stratégique avant le 12 mars, santé). Le Pen dit « pas de plan B » et destine Bardella à Matignon.","sources":[{"label":"franceinfo.fr","href":"https://www.franceinfo.fr/politique/front-national/affaire-des-assistants-fn-au-parlement-europeen/il-va-accepter-sans-probleme-la-decision-de-marine-le-pen-comment-jordan-bardella-et-la-candidate-du-rn-vont-ils-faire-campagne-en-binome-en-2027_8098388.html"}],"condition_id":"rn.bardella"}]},{"id":"centre","question":"Quelle offre pour le bloc central ?","review":["chaque mois jusqu'au 2027-03-12"],"states":[{"id":"philippe_only","probability":0.5,"candidates":["philippe_edouard"],"placeholders":[],"description":"Philippe seul candidat du bloc central : Attal se retire. Philippe seul gagne 6 à 8 points sur le cas à deux (Ifop, septembre 2026) ; Attal seul fait 13 % contre 18 % pour Philippe seul (Ifop, 12-14 octobre 2026). Darmanin et Wauquiez soutiennent Philippe.","sources":[{"label":"journaldunet.com","href":"https://www.journaldunet.com/business/action-publique/1532943-edouard-philippe-officialise-sa-candidature-a-la-presidentielle-2027-et-se-dit-pret-en-cas-de-scrutin-anticipe/"},{"label":"touteleurope.eu","href":"https://touteleurope.eu/vie-politique-des-etats-membres/presidentielle-2027-marine-le-pen-largement-en-tete-dans-les-sondages-a-six-mois-du-premier-tour-trois-candidats-au-coude-a-coude-pour-la-deuxieme-place"},{"label":"rtl.fr","href":"https://www.rtl.fr/actu/politique/edouard-philippe-peut-incarner-l-ordre-et-le-serieux-laurent-wauquiez-soutient-le-candidat-horizons-et-invite-bruno-retailleau-a-se-retirer-7900651585"}],"condition_id":"centre.philippe_only"},{"id":"philippe_attal","probability":0.35,"candidates":["philippe_edouard","attal_gabriel"],"placeholders":[],"description":"Philippe et Attal tous deux candidats au premier tour. Attal, déclaré le 22 mai 2026, n'exclut pas une primaire que Philippe refuse ; aucun accord de retrait n'est sourcé au 20 octobre.","sources":[{"label":"lcp.fr","href":"https://lcp.fr/actualites/presidentielle-2027-gabriel-attal-officialise-sa-candidature-436721"}],"condition_id":"centre.philippe_attal"},{"id":"attal_only","probability":0.1,"candidates":["attal_gabriel"],"placeholders":[],"description":"Attal seul : Philippe se retire (santé, affaire, effondrement sondagier). Peu probable, Philippe étant en tête du bloc dans tous les sondages.","sources":[],"condition_id":"centre.attal_only"},{"id":"other","probability":0.05,"candidates":[],"placeholders":["centre"],"description":"Ni Philippe ni Attal : candidat de substitution du bloc central non identifié (pressentis : Le Maire, Bergé, Barrot, Breton selon WP_CAND).","sources":[{"label":"WP_CAND","href":"https://fr.wikipedia.org/wiki/Candidatures_%C3%A0_l%27%C3%A9lection_pr%C3%A9sidentielle_fran%C3%A7aise_de_2027"}],"condition_id":"centre.other"}]},{"id":"left","question":"La gauche hors LFI est-elle consolidée derrière Glucksmann ?","review":["2027-03-12 (clôture des parrainages)"],"states":[{"id":"consolidated","probability":0.35,"candidates":["glucksmann_raphael"],"placeholders":[],"description":"Glucksmann seul candidat de la gauche hors LFI, avec au plus un petit candidat (Batho) : Tondelier, Ruffin, Cazeneuve, Hollande et Bouamrane se rallient ou n'obtiennent pas leurs parrainages (voir la contrainte left_consolidated). Roussel (PCF, bloc far_left) est traité à part comme petit candidat.","sources":[{"label":"lcp.fr","href":"https://lcp.fr/actualites/primaire-socialiste-vainqueur-des-le-1er-tour-raphael-glucksmann-sera-le-candidat-de-la"},{"label":"publicsenat.fr","href":"https://www.publicsenat.fr/actualites/politique/primaire-de-la-gauche-raphael-glucksmann-plie-le-match-et-remporte-le-scrutin-des-le-premier-tour-avec-66"}],"condition_id":"left.consolidated"},{"id":"fragmented","probability":0.65,"candidates":["glucksmann_raphael","tondelier_marine"],"placeholders":[],"description":"Glucksmann et Tondelier présents ; Ruffin, Cazeneuve, Hollande, Bouamrane, Batho et Roussel selon leurs probabilités de petits candidats. La primaire unitaire a échoué, Tondelier est désignée par Les Écologistes le 21 septembre 2026, Ruffin a dit « s'il n'y a pas de primaire, moi j'y vais ».","sources":[{"label":"en.wikipedia.org","href":"https://en.wikipedia.org/wiki/2026_United_Left_primary"},{"label":"lcp.fr","href":"https://lcp.fr/actualites/presidentielle-2027-s-il-n-y-a-pas-de-primaire-moi-j-y-vais-annonce-francois-ruffin"},{"label":"WP_CAND","href":"https://fr.wikipedia.org/wiki/Candidatures_%C3%A0_l%27%C3%A9lection_pr%C3%A9sidentielle_fran%C3%A7aise_de_2027"}],"condition_id":"left.fragmented"}]},{"id":"lr","question":"LR présente-t-il Bruno Retailleau ?","review":["2027-03-12 (clôture des parrainages)"],"states":[{"id":"retailleau","probability":0.8,"candidates":["retailleau_bruno"],"placeholders":[],"description":"Retailleau, désigné par LR le 19 avril 2026, va au premier tour. Barnier, Baroin, Pécresse et Ménard le soutiennent (WP_CAND).","sources":[{"label":"WP_CAND","href":"https://fr.wikipedia.org/wiki/Candidatures_%C3%A0_l%27%C3%A9lection_pr%C3%A9sidentielle_fran%C3%A7aise_de_2027"}],"condition_id":"lr.retailleau"},{"id":"rally","probability":0.2,"candidates":[],"placeholders":[],"description":"LR se rallie à un candidat du bloc central (Philippe) avant le 12 mars. Wauquiez, président du groupe LR à l'Assemblée, soutient Philippe depuis le 1er juillet 2026 et estime que Retailleau, « en dessous de 10 % », doit savoir se retirer.","sources":[{"label":"bfmtv.com","href":"https://www.bfmtv.com/politique/elections/presidentielle/le-candidat-lr-est-en-dessous-de-10-laurent-wauquiez-juge-que-bruno-retailleau-doit-savoir-se-retirer-si-c-est-necessaire-et-tend-la-main-a-edouard-philippe-pour-la-presidentielle_AN-202607010735.html"}],"condition_id":"lr.rally"}]},{"id":"lfi","question":"Qui porte la candidature de LFI ?","review":[],"states":[{"id":"melenchon","probability":0.97,"candidates":["melenchon_jean_luc"],"placeholders":[],"description":"Mélenchon, déclaré le 3 mai 2026 (TF1), électorat le plus sûr de son choix (Elabe) ; le NPA-L'Anticapitaliste le soutient (29 juin 2026).","sources":[{"label":"WP_CAND","href":"https://fr.wikipedia.org/wiki/Candidatures_%C3%A0_l%27%C3%A9lection_pr%C3%A9sidentielle_fran%C3%A7aise_de_2027"},{"label":"franceinfo.fr","href":"https://www.franceinfo.fr/elections/presidentielle/le-npa-anticapitaliste-renonce-a-presenter-un-candidat-a-l-election-presidentielle-2027-et-annonce-soutenir-jean-luc-melenchon_8084936.html"}],"condition_id":"lfi.melenchon"},{"id":"substitute","probability":0.03,"candidates":["bompard_manuel"],"placeholders":[],"description":"Mélenchon empêché ; LFI présente un autre candidat, représenté par Manuel Bompard (coordinateur du mouvement), faute de nom annoncé.","sources":[],"condition_id":"lfi.substitute"}]},{"id":"reconquete","question":"Reconquête présente-t-il un candidat, et lequel ?","review":["2027-03-12 (clôture des parrainages)"],"states":[{"id":"zemmour","probability":0.88,"candidates":["zemmour_eric"],"placeholders":[],"description":"Zemmour, candidature confirmée le 17 septembre 2026 sur BFMTV ; candidat en 2022 avec ses parrainages.","sources":[{"label":"bfmtv.com","href":"https://www.bfmtv.com/politique/elections/presidentielle/je-serai-candidat-eric-zemmour-annonce-sur-bfmtv-qu-il-se-presentera-a-l-election-presidentielle_AV-202609170947.html"}],"condition_id":"reconquete.zemmour"},{"id":"knafo","probability":0.02,"candidates":["knafo_sarah"],"placeholders":[],"description":"Knafo remplace Zemmour. Elle a déclaré le 29 avril 2026 ne pas être candidate et soutient Zemmour : branche résiduelle.","sources":[{"label":"franceinfo.fr","href":"https://www.franceinfo.fr/politique/pas-candidate-a-l-election-presidentielle-de-2027-sarah-knafo-lance-une-grande-consultation-des-francais_7970540.html"}],"condition_id":"reconquete.knafo"},{"id":"none","probability":0.1,"candidates":[],"placeholders":[],"description":"Pas de candidat Reconquête au premier tour (parrainages manqués ou retrait au profit du RN).","sources":[],"condition_id":"reconquete.none"}]}],"small_candidates":[{"candidate_id":"dupont_aignan_nicolas","probability":0.75,"bloc":"far_right","rationale":"Candidature officialisée le 19 septembre 2026 (JDD), quatrième campagne ; présent en 2012, 2017 et 2022 (elections.yaml).","sources":[{"label":"WP_CAND","href":"https://fr.wikipedia.org/wiki/Candidatures_%C3%A0_l%27%C3%A9lection_pr%C3%A9sidentielle_fran%C3%A7aise_de_2027"},{"label":"FI_LISTE","href":"https://www.franceinfo.fr/elections/presidentielle/portraits-qui-sont-les-candidats-declares-a-l-election-presidentielle-de-2027_8208032.html"}]},